{
  "$schema": "https://json-schema.org/draft/2020-12/schema",
  "$id": "https://github.com/Arth-Singh/Stresskit/blob/main/src/stresskit/schemas/stability_card_v0.json",
  "title": "StressKit Stability Card",
  "description": "Machine-readable record of how a mechanistic-interpretability claim held up under a perturbation battery.",
  "type": "object",
  "required": [
    "schema_version",
    "stresskit_version",
    "created_at",
    "claim",
    "battery",
    "metrics",
    "verdict",
    "provenance"
  ],
  "properties": {
    "schema_version": {
      "enum": [
        "0.1",
        "0.2",
        "0.3",
        "0.4"
      ]
    },
    "stresskit_version": {
      "type": "string"
    },
    "created_at": {
      "type": "string",
      "format": "date-time"
    },
    "claim": {
      "type": "object",
      "required": [
        "statement"
      ],
      "properties": {
        "statement": {
          "type": "string"
        },
        "base_claim_label": {
          "type": [
            "string",
            "null"
          ]
        },
        "model": {
          "type": [
            "string",
            "null"
          ]
        },
        "task": {
          "type": [
            "string",
            "null"
          ]
        },
        "method": {
          "type": [
            "string",
            "null"
          ]
        },
        "base_size": {
          "type": [
            "integer",
            "null"
          ]
        },
        "universe_size": {
          "type": [
            "integer",
            "null"
          ]
        }
      }
    },
    "battery": {
      "type": "object",
      "required": [
        "axes",
        "n_runs_total",
        "seed"
      ],
      "properties": {
        "axes": {
          "type": "array",
          "items": {
            "type": "string"
          }
        },
        "n_runs_total": {
          "type": "integer",
          "minimum": 1
        },
        "seed": {
          "type": "integer"
        },
        "base_config": {
          "type": "object"
        },
        "claim_equiv_used": {
          "type": "boolean"
        },
        "components_embedded": {
          "type": "boolean"
        },
        "structure_kind": {
          "enum": [
            "set",
            "direction"
          ],
          "description": "Structural kind of the graded findings. Absent means 'set' (every card before schema 0.4). Direction cards grade mean pairwise |cosine| instead of Jaccard and carry a 'directions' block."
        }
      }
    },
    "metrics": {
      "type": "object",
      "required": [
        "pooled"
      ],
      "properties": {
        "pooled": {
          "$ref": "#/$defs/summary"
        },
        "per_axis": {
          "type": "object",
          "additionalProperties": {
            "$ref": "#/$defs/summary"
          }
        },
        "null_control": {
          "$ref": "#/$defs/summary"
        }
      }
    },
    "verdict": {
      "type": "object",
      "required": [
        "grade",
        "checks"
      ],
      "properties": {
        "grade": {
          "enum": [
            "A",
            "B",
            "C",
            "D"
          ]
        },
        "profile": {
          "enum": [
            "diagnostic",
            "confirmatory"
          ],
          "description": "Diagnostic cards localize sensitivity and cannot issue a confirmatory certificate."
        },
        "confirmatory_state": {
          "enum": [
            "pass",
            "fail",
            "inconclusive",
            "not_applicable"
          ]
        },
        "required_checks": {
          "type": "array",
          "items": {
            "type": "string"
          },
          "uniqueItems": true
        },
        "checks": {
          "type": "object",
          "additionalProperties": {
            "type": "object",
            "required": [
              "value",
              "threshold",
              "passed"
            ],
            "properties": {
              "value": {
                "type": [
                  "number",
                  "null"
                ]
              },
              "threshold": {
                "type": "number"
              },
              "passed": {
                "type": "boolean"
              },
              "description": {
                "type": "string"
              },
              "op": {
                "enum": [
                  ">=",
                  "<="
                ]
              },
              "ci": {
                "type": [
                  "array",
                  "null"
                ],
                "items": {
                  "type": "number"
                },
                "minItems": 2,
                "maxItems": 2
              },
              "robust": {
                "type": [
                  "boolean",
                  "null"
                ],
                "description": "True when the 95% CI decides the verdict (entirely on the passing side for a pass, failing side for a fail); False when it straddles the threshold; null when no CI exists."
              },
              "state": {
                "enum": [
                  "pass",
                  "fail",
                  "inconclusive"
                ],
                "description": "Normative interval-wide state. Schema 0.3 requires this field; older cards may omit it."
              }
            }
          }
        },
        "thresholds": {
          "type": "object"
        }
      }
    },
    "provenance": {
      "type": "object",
      "properties": {
        "python": {
          "type": "string"
        },
        "platform": {
          "type": "string"
        },
        "wall_seconds": {
          "type": "number"
        }
      }
    },
    "notes": {
      "type": "array",
      "items": {
        "type": "string"
      }
    },
    "runs": {
      "type": "array",
      "description": "Per-run records: enough to recompute the pooled metrics from the card alone. Components are embedded when the battery total is <= 20000 entries; every structured run carries a SHA-256 digest of its components regardless.",
      "items": {
        "type": "object",
        "required": [
          "axis",
          "variant",
          "size"
        ],
        "properties": {
          "axis": {
            "type": "string"
          },
          "variant": {
            "type": "string"
          },
          "seed": {
            "type": "integer"
          },
          "size": {
            "type": "integer"
          },
          "claim": {
            "type": [
              "string",
              "null"
            ]
          },
          "score": {
            "type": [
              "number",
              "null"
            ]
          },
          "universe": {},
          "structure_present": {
            "type": "boolean",
            "description": "True when the method produced a structural set, including an explicitly empty set; false means structure was not an output."
          },
          "components": {
            "type": "array",
            "items": {
              "type": "string"
            }
          },
          "components_sha256": {
            "type": "string",
            "pattern": "^[0-9a-f]{64}$"
          },
          "direction_dim": {
            "type": "integer",
            "minimum": 1
          },
          "direction_sha256": {
            "type": "string",
            "pattern": "^[0-9a-f]{64}$",
            "description": "SHA-256 of this run's unit-normalized direction. The card embeds the pairwise |cosine| matrix rather than the vectors, so this is what ties the matrix to the directions an auditor holds."
          }
        }
      }
    },
    "utility": {
      "type": "object",
      "description": "Optional second axis: what the finding bought on a task stated outside interpretability, against a baseline that never reads model internals. Absent means the question was not answered, not that it passed.",
      "required": [
        "task",
        "metric",
        "with_method",
        "baselines",
        "n",
        "delta_vs_non_internals"
      ],
      "properties": {
        "task": {
          "type": "string"
        },
        "metric": {
          "type": "string"
        },
        "n": {
          "type": "integer",
          "minimum": 1
        },
        "with_method": {
          "type": "number"
        },
        "baselines": {
          "type": "array",
          "minItems": 1,
          "items": {
            "type": "object",
            "required": [
              "name",
              "value",
              "uses_internals"
            ],
            "properties": {
              "name": {
                "type": "string"
              },
              "value": {
                "type": "number"
              },
              "uses_internals": {
                "type": "boolean"
              }
            }
          }
        },
        "reference_baseline": {
          "type": "string"
        },
        "delta_vs_non_internals": {
          "type": "number"
        },
        "delta_ci95": {
          "type": "array",
          "items": {
            "type": "number"
          },
          "minItems": 2,
          "maxItems": 2
        },
        "bootstrap": {
          "type": "object"
        },
        "task_phrasing_warning": {
          "type": "string"
        }
      }
    },
    "directions": {
      "type": "object",
      "description": "Direction-valued structural evidence (schema 0.4). The pairwise |cosine| matrix over exactly the runs that were graded, which is quadratic in run count rather than linear in model width and still makes the structural metric, its bootstrap CI, and the grade recomputable offline.",
      "required": [
        "dim"
      ],
      "properties": {
        "dim": {
          "type": "integer",
          "minimum": 1
        },
        "order": {
          "type": "array",
          "items": {
            "type": "string"
          },
          "description": "Run variants indexing the matrix, in matrix order."
        },
        "embedded": {
          "type": "boolean",
          "description": "False when the battery exceeded the pair cap and only per-run dimensions and digests were kept."
        },
        "abs_cosine": {
          "type": "array",
          "items": {
            "type": "array",
            "items": {
              "type": "number",
              "minimum": 0,
              "maximum": 1
            }
          },
          "description": "Symmetric |cosine| matrix with a unit diagonal over the graded runs."
        },
        "null_abs_cosine": {
          "type": "array",
          "items": {
            "type": "array",
            "items": {
              "type": "number",
              "minimum": 0,
              "maximum": 1
            }
          },
          "description": "Same, over the null-control runs, so specificity and its interval recompute too."
        },
        "bootstrap": {
          "type": "object",
          "description": "Parameters the stored intervals were drawn with, so verification is not hostage to a future change of defaults.",
          "properties": {
            "n_boot": {
              "type": "integer"
            },
            "alpha": {
              "type": "number"
            },
            "seed": {
              "type": "integer"
            }
          }
        }
      }
    }
  },
  "$defs": {
    "summary": {
      "type": "object",
      "properties": {
        "n_runs": {
          "type": "integer"
        },
        "mean_pairwise_jaccard": {
          "type": [
            "number",
            "null"
          ]
        },
        "min_pairwise_jaccard": {
          "type": [
            "number",
            "null"
          ]
        },
        "flip_rate": {
          "type": [
            "number",
            "null"
          ]
        },
        "modal_share": {
          "type": [
            "number",
            "null"
          ]
        },
        "n_claim_classes": {
          "type": "integer"
        },
        "claim_counts": {
          "type": "object"
        },
        "score_mean": {
          "type": [
            "number",
            "null"
          ]
        },
        "score_std": {
          "type": [
            "number",
            "null"
          ]
        },
        "score_cv": {
          "type": [
            "number",
            "null"
          ]
        },
        "median_size": {
          "type": [
            "number",
            "null"
          ]
        },
        "expected_random_jaccard": {
          "type": [
            "number",
            "null"
          ]
        },
        "jaccard_vs_random": {
          "type": [
            "number",
            "null"
          ]
        },
        "variance_shares": {
          "type": "object"
        },
        "mean_pairwise_jaccard_all_sizes": {
          "type": [
            "number",
            "null"
          ]
        },
        "n_size_mismatched_excluded": {
          "type": "integer"
        },
        "mean_pairwise_jaccard_ci95": {
          "type": [
            "array",
            "null"
          ],
          "items": {
            "type": "number"
          },
          "minItems": 2,
          "maxItems": 2
        },
        "flip_rate_ci95": {
          "type": [
            "array",
            "null"
          ],
          "items": {
            "type": "number"
          },
          "minItems": 2,
          "maxItems": 2
        },
        "modal_share_ci95": {
          "type": [
            "array",
            "null"
          ],
          "items": {
            "type": "number"
          },
          "minItems": 2,
          "maxItems": 2
        },
        "score_cv_ci95": {
          "type": [
            "array",
            "null"
          ],
          "items": {
            "type": "number"
          },
          "minItems": 2,
          "maxItems": 2
        },
        "jaccard_vs_random_ci95": {
          "type": [
            "array",
            "null"
          ],
          "items": {
            "type": "number"
          },
          "minItems": 2,
          "maxItems": 2
        },
        "specificity_ci95": {
          "type": [
            "array",
            "null"
          ],
          "items": {
            "type": "number"
          },
          "minItems": 2,
          "maxItems": 2
        },
        "expected_random_jaccard_analytic": {
          "type": [
            "number",
            "null"
          ]
        },
        "mean_pairwise_jaccard_axis_balanced": {
          "type": [
            "number",
            "null"
          ]
        },
        "variance_absolute": {
          "type": "object"
        },
        "n_cross_universe_excluded": {
          "type": "integer"
        },
        "confidence": {
          "enum": [
            "high",
            "low",
            "unknown"
          ]
        },
        "borderline_checks": {
          "type": "array",
          "items": {
            "type": "string"
          }
        },
        "mean_pairwise_abs_cosine": {
          "type": [
            "number",
            "null"
          ]
        },
        "min_pairwise_abs_cosine": {
          "type": [
            "number",
            "null"
          ]
        },
        "mean_pairwise_abs_cosine_axis_balanced": {
          "type": [
            "number",
            "null"
          ]
        },
        "expected_random_abs_cosine": {
          "type": [
            "number",
            "null"
          ]
        },
        "abs_cosine_vs_random": {
          "type": [
            "number",
            "null"
          ]
        },
        "n_direction_runs": {
          "type": "integer"
        },
        "direction_dim": {
          "type": [
            "integer",
            "null"
          ]
        },
        "mean_pairwise_abs_cosine_ci95": {
          "type": [
            "array",
            "null"
          ],
          "items": {
            "type": "number"
          },
          "minItems": 2,
          "maxItems": 2
        },
        "abs_cosine_vs_random_ci95": {
          "type": [
            "array",
            "null"
          ],
          "items": {
            "type": "number"
          },
          "minItems": 2,
          "maxItems": 2
        }
      }
    }
  }
}
